name,category
"글라스락 사각 캐니스터 유리용기, 2L, 4개",생활용품
에이든 홈푸드 1L 다용도 믹서기 MJ-336S,생활용품
"락앤락 메트로 머그 LHC4282, 옐로우(LHC4282YEL), 600ml",생활용품
"쿠쿠 IH 전기 압력밥솥 6인용, CRP-DHB0660FDM",생활용품
"브리타 마렐라XL 화이트 3.5L+한국형 필터1개 기본구성, 1개, Marella XL White",생활용품
"홈플래닛 전동 멀티 다지기 2L, LB7004A",생활용품
"일리 인텐소 캡슐커피, 6.7g, 100개입, 1개",생활용품
"SK매직 간편핸들 전자레인지 다이얼식 20L, MWO20MC9",생활용품
"올리빙 도트 아이스박스, 모스그린, 25L",생활용품
"기본에 세균닦는 행주 티슈 캡형, 80매, 10팩",생활용품
"쿠쿠 IH전기압력밥솥 10인용, CRP-HWF1060FB",생활용품
"스타벅스 하우스블렌드 캡슐커피, 8.5g, 12개입, 4개",생활용품
"코멧 니트릴장갑 블랙, 중(M), 200개, 1개",생활용품
"홈플래닛 푸드 다용도 믹서기, SBL365AB",생활용품
"카누 밸런스 디카페인 네스프레소 호환 캡슐 커피, 5.7g, 10개입, 6개",생활용품
"코멧 밀짚 도시락 세트 1100ml + 850ml + 파우치, 1개",생활용품
"생활공식 양면 스펀지 수세미 그레이, 10개, 1개입",생활용품
"키친아트 본 핑크 후라이팬 세트, 프라이팬 + 궁중팬 + 뚜껑(28cm) + 에그팬(16cm)",생활용품
"카스 디지털 정밀 저울 5kg, WA-21D",생활용품
"퀸센스 올스텐 잔치팬, 1개, 34cm",생활용품
"퍼기 유아용 자기주도 냥냥 흡착 식판, 단품, 드라이로즈",생활용품
"코멧 라텍스 장갑 소형 S, 200개, 1개, 소(S)",생활용품
"코멧 칵테일 냅킨, 갈색, 1박스, 4000매",생활용품
"브리타 막스트라플러스 한국형 필터 3 + 1, 1개, MAXTRA한국형",생활용품
"깨끗한나라 데일리 천연펄프 키친타올 150매, 8롤, 3팩",생활용품
"실리쿡 깊은 2호 트레이세트, 1세트, 깊은 2호 5p + 트레이 중",생활용품
"바겐슈타이거 스텐304 클라 드레인 앤 커버 싱크대 배수구 거름망 + 커버 세트, 1세트",생활용품
필립스 파워 블렌더 5000 시리즈 HR2228/90,생활용품
"테팔 솔레이 스타일리시 토스터기, TT303AKR",생활용품
"코멧 니트릴장갑 화이트, 중(M), 200매, 1개",생활용품
"코멧 키친 왕계란말이 멀티팬 대형, 26 x 23 cm, 1개",생활용품
"까박 프리미엄 옥수수 수세미, 5개",생활용품
"리본제이 무디타 마그넷 스테인리스 슬라이서 멀티 만능 채칼 세트, 1세트, 쿨그레이",생활용품
"삼성전자 BESPOKE 식기세척기 카운터탑 6인용, DW30A3030CE(화이트), 방문설치",생활용품
"퀸센스 시그니처 IH 프라이팬, 1개, 28cm",생활용품
"씨밀렉스 쿡밥 사각 전자레인지 용기 260ml, 랜덤 발송, 14개",생활용품
"테팔 뉴 컴포트 그립 프라이팬, 30cm, 1개",생활용품
"에디슨 온도 표시 원터치 분유 보온병, 베이지, 500ml",생활용품
"로이첸 유청분리기 그릭요거트 메이커, 시럽 민트, 1개",생활용품
"몬타 애드크로스 5분 누룽지 가마솥 3~4인용, 혼합색상, 1.2L",생활용품
일리 프란시스 Y3.3 커피머신 화이트 + 웰컴 캡슐 랜덤발송 14p,생활용품
"락앤락 쌀통 10kg (12L), 1개",생활용품
"퍼기 이유식 마스터 6~10인용 밥솥 칸막이, 브라운, 1개",생활용품
"스타벅스 에스프레소 로스트 by 네스카페 돌체구스토 캡슐커피, 5.5g, 12개, 3개",생활용품
"글래드 매직랩 일반형 30cm x 21.6m, 6개",생활용품
"나누담 야채 채소 과일 정리수납 채반 밀폐용기 4000ml, 2개, 단품",생활용품
"필립스 3000 시리즈 무선 전기포트, HD9318/00",생활용품
"네스카페 돌체구스토 아메리카노 캡슐커피, 7.9g, 16개입, 3개",생활용품
"므어므어 마그넷 홀더 컬러랙 스틸 키친타올걸이, 화이트, 1개",생활용품
"락앤락 메트로 내열유리 저그 LLG6101, 1.5L",생활용품
"탐사 고평량 종이컵 무인쇄 380ml, 600개입",생활용품
"코멧 니트릴장갑 화이트, 소(S), 200매, 1개",생활용품
"코멧 라텍스 장갑 중형 M, 200개, 1개",생활용품
"락앤락 DOSILOCK 프로페셔널 3단 도시락 360ml + 530ml, 옐로우, 1개",생활용품
"탐사 무인쇄 종이컵 180ml, 2800개입",생활용품
"도무스 트래블 폴딩포트 0.6, DK-3632SR",생활용품
"오슬로 아웃백 트래블 텀블러, 900ml, 아이보리",생활용품
"글라스락 퍼플에디션 직사각 밀폐용기 715ml, 4개, 단품",생활용품
"코멧 키친 티타늄코팅 후라이팬, 30 cm, 1개",생활용품
"코멧 니트릴장갑 화이트, 대(L), 200매, 1개",생활용품
"스탠리 고 진공 보틀, 해머톤 그린, 473ml",생활용품
"삼성전자 세라믹 전자레인지 버튼식 23L, MS23K3523AK",생활용품
"코멧 니트릴장갑 블랙, 중(M), 400개, 1개",생활용품
"SK매직 고급형 전자레인지 20L, MWO-20EC2",생활용품
"5분 바로 밥 누룽지 가마솥 손잡이형 + 나무 세트 + 계량컵, 0.8L, 은색, 검정색",생활용품
"스타벅스 하우스블렌드 by 네스카페 돌체구스토 캡슐커피, 8.5g, 12개입, 3개",생활용품
"락앤락 비스프리 모듈러 밀폐용기 세트, 4개입, 단품",생활용품
"삼성전자 세라믹 전자레인지 버튼식 23L, MS23K3523AW",생활용품
"베로나 IH 멀티플렉스 팬, 20cm, 크림아이보리",생활용품
"테팔 올레아 무선 전기주전자 1.7L, KI160DKR",생활용품
"코멧 슬라이더 지퍼백 스탠딩 대형, 1개, 대(L)",생활용품
"코스모스 하드케이스 아이스팩 650ml, 1개입, 5개",생활용품
"스탠리 처 H2.0 플로우스테이트 텀블러, 591ml, 크림",생활용품
"스탠리 어드벤쳐 처 텀블러, 폴라 화이트, 473ml",생활용품
"락앤락 숨쉬는 스텐 김치통, 3.8L, 1개",생활용품
"이지엔 슬라이더 지퍼백, 중(M), 75개입, 1개",생활용품
"마더센트 싱크대 수도꼭지 녹물필터헤드 코브라 타입 호환 필터 헤드 + 리필 필터 7p 세트, 1세트",생활용품
"락앤락 원터치 클립 텀블러, BLK, 550ml",생활용품
"락앤락 비스프리 모듈러 정사각 600ml, 4개입, 단품",생활용품
"착한살림 모던 2구 규조토 물빠짐 수저통 세트, 화이트, 1세트",생활용품
"EZn이지엔 니트릴 장갑 200p, 블랙, 중(M), 1세트",생활용품
"브릭글로 스탠다드 니트릴장갑 100p, 블랙, 대(L), 2개",생활용품
"키친아트 라팔 뉴 멀티 포트 전기냄비 1.7, KP-1007FT",생활용품
"생활공작소 라텍스 밴드형 고무장갑 양손 세트, 그레이, 중(M), 3세트",생활용품
"코멧 빨아쓰는 데일리 행주 50매, 2팩",생활용품
"퓨리얼 정수기 필터 1년 세트, PPA-100, 1세트",생활용품
"미리내 MK-105 측면 고급형 원홀 주방수전, 1개",생활용품
"스탠리 처 H2.0 플로우스테이트 텀블러, 591ml, 로즈쿼츠",생활용품
"로렘 접이식 서랍형 독서대 베드테이블, 화이트40*70",생활용품
"네스프레소 에센자 미니, C30(블랙)",생활용품
"스타벅스 하우스블렌드 by 네스카페 돌체구스토 캡슐커피, 8.5g, 12개입, 3개",생활용품
"쿠쿠 10인용 전기압력밥솥, CRP-QS1020FSM",생활용품
"락앤락 비스프리 모듈러 직사각, 2개, 910ml",생활용품
"필립스 데일리 컬렉션 메탈 무선 전기주전자, HD9350/93",생활용품
"키친아트 스테인레스 사각 설거지통 10L, 1개",생활용품
"리본제이 무디타 마그넷 스테인리스 슬라이서 멀티 만능 채칼 세트, 1세트, 쿨그레이",생활용품
"어반파파 어썸루파 수세미, 1개입, 4개",생활용품
"락앤락 뉴자이언트핫탱크 보온병, 사파이어골드, 1.5L",생활용품
"쿠쿠 전기압력밥솥 6인용, CRP-P0620FDM",생활용품
"르메이드 스테인레스 음식물 쓰레기통, 화이트",생활용품
"스타벅스 에스프레소 로스트 by 네스카페 돌체구스토 캡슐커피, 5.5g, 12개입, 3개",생활용품
"락앤락 쌀통 + 계량컵 + 제습제, 혼합색상",생활용품
"다소다 밤부 도시락통 세트, 브라운 세트, 1세트",생활용품
"락앤락 로즈골드 IH 인덕션 후라이팬, 28cm, 1개",생활용품
"잘풀리는집 맥스 다용도 키친타올 250매, 12개, 250개입",생활용품
"쿠쿠 저소음 에어프라이어 5.5L, 그레이스 화이트, CAF-G0610DW",생활용품
"글렌캐런 글래스 트윈세트, 1세트",생활용품
"미디어 디지털식 전자레인지 20L 화이트, MW5000",생활용품
"하이비 젖병 젖꼭지 세척솔 몽글이 듀얼 버블프로솔, 5개, 따뜻한햇살",생활용품
"EZn이지엔 뽑아쓰는 위생백 중형 600매, 600개입, 1개",생활용품
"BSW 계란 찜기, BS-1236-EB1, 1개",생활용품
"코멧 생분해 음식물쓰레기 봉투 50매, 1개, 1L",생활용품
"유앤팩 다용도 밀폐죽용기 대 900ml, 50개, 1개입",생활용품
"글래드 매직랩 일반형, 3개",생활용품
"깨끗한나라 데일리 천연펄프 키친타올 200매, 12개",생활용품
"블랑 휴대용 가스렌지 + 전용 케이스 세트, 화이트, 1세트",생활용품
"이지엔 슬라이더 지퍼백, 대(L), 60개입, 1개",생활용품
"코멧 테이블 아이스박스, 네이비, 13L",생활용품
"스탠리 처 H2.0 플로우스테이트 텀블러, 591ml, 차콜",생활용품
"크라운포드 2인 식기세트 14p, 셀렘, 7종",생활용품
"코멧 키친 티타늄코팅 궁중팬, 30cm, 1개",생활용품
"락앤락 데일리팝 원터치텀블러, 멜론민트, 350ml",생활용품
"코멧 생분해 음식물쓰레기 봉투 50매, 1개, 3.5L",생활용품
"로이첸 그릭 요거트 메이커 투명한 유청 분리기, 파인 옐로우, 1개",생활용품
"올리빙 도트 아이스박스, 그레이, 25L",생활용품
"동우 삼겹살 사각 구이판, 33.2 x 29.8 x 3.5cm, 1개",생활용품
"제니네 스테인레스 304 싱크대 배수구 거름망, 1개입, 1개",생활용품
"3M 스카치브라이트 내츄럴 옥수수 망사 수세미, 9개입, 1개",생활용품
"락앤락 항균 스테커블 밀폐용기 직사각 라이트 그레이 350ml, 4개, 단품",생활용품
"코멧 키친 티타늄코팅 궁중팬, 28cm, 1개",생활용품
"글라스락 렌지쿡 따뜻한 죽 전자레인지 용기 500ml, 무드브릭, 2개",생활용품
"락앤락 스테커블 직사각 600ml 3P, 3개, 단품",생활용품
"탐사 무인쇄 종이컵 180ml, 2000개입",생활용품
"크리넥스 빨아쓰는 위생행주 블루 72매, 1개, 12개입",생활용품
"리빙웰 나무젓가락, 100개입, 3개",생활용품
"락앤락 쉐이킷보틀 프로 스테인리스, 라이트그레이, 650ml",생활용품
"코멧 키친 스테인레스 식기건조대 2단, 블랙",생활용품
"프로그 일회용 수세미 엑스트라 스트롱 60p, 베이지, 60개입, 3개",생활용품
"프로그 더블 지퍼백 냉동용 중형 60매 + 대형 40매 세트, 혼합, 1세트",생활용품
"생활공식 2단 접시정리대 3p, 화이트",생활용품
"탐사 고평량 종이컵 무인쇄 380ml, 300개입",생활용품
책상세트 가구 책상+서랍+의자 사무실가구,인테리어
멜론책상 D600~D800 컴퓨터용 사무용가구,인테리어
마이사이즈체어 M900MQ 컴퓨터의자,인테리어
EX퍼니처 게이밍 컴퓨터 PC방 중역 사무용 사무실 책상 의자 메쉬체어 TYPE-7 PRO,인테리어
퍼스퍼 내추럴 바른 자세교정 메쉬 편한 컴퓨터의자 사무용 사무실의자 학생 공부 책상의자,인테리어
먼지없는 이불 세트 알러지케어 여름 차렵이불 침구세트,인테리어
누보레 한아름 스노우 경추베개 목디스크 일자목 거북목베개 1+1,인테리어
본베베 아기 침대가드 낙상방지 유아 안전가드 110,인테리어
스스디 비스포크 슬라이딩 틈새수납장 냉장고 세탁실 김치냉장고 틈새장,인테리어
정국이 사용한 경추베개 거북목 일자목 목디스크 경추 목베개 편백 메밀 베고자니,인테리어
왕자행거 2단 조절 행거 38mm,인테리어
시스템행거 옷걸이 드레스룸 2단 행거 철제 선반 옷장 조립식 커튼,인테리어
선반 수납선반 다용도 철제선반 시스템 조립 팬트리 랙 모듈 다용도실 선반장,인테리어
리빙제이 빨아쓰는 규조토 발매트 욕실 주방 화장실 매트 3세대 60x40,인테리어
집성목 DIY 목재재단 나무구입 합판 방부목 MDF 선반,인테리어
오스본가구 원조 라티나 구스다운 4인용 가죽 소파,인테리어
한샘 샘 책장 5단 120cm 시공포함,인테리어
해바라기 그림 집들이 선물 개업 축하 결혼 임신 돈들어오는 액자 거실 인테리어 소품 사진,인테리어
데코지오 쉐도우 아일렛형 100% 암막커튼 160,인테리어
아오라 우주빔 우주 조명 별 달 은하수 프로젝터 별똥별 오로라 무드등 수면등 집들이선물,인테리어
현관코일매트 현관매트 베란다 바닥 발코니 사무실 매장 업소용 출입구 통풍형 두께 16mm,인테리어
하벤홈 패브릭 가벽 칸막이 공간분리 이동식 인테리어 가림막 파티션 800mm,인테리어
조은자리 대형 바디필로우 6종 듀라론 냉감 죽부인 안고자는 긴 베개 롱쿠션 롱베개 커버,인테리어
메르헨몬드 국산 마스터 무소음 벽시계 벽걸이시계 사무실 로고 문구 인쇄,인테리어
LED 다운라이트 매립등 6인치 15W 20W 국산,인테리어
무아스 풀문 백라이트 무드등 LED 벽시계,인테리어
빅베어브릭 석고방향제 인테리어소품 르마엔베어 르마앤베어 실내 디퓨저 집들이 선물 집,인테리어
무무네 웁스 디퓨저 300ml 실내방향제 화장실 인테리어 사무실 선물 대용량 에어리샤워,인테리어
리브맘 숨쉬는 진드기방지 쫀득 매트리스 방수커버,인테리어
디아르 시그니쳐 국내산 실리콘 식탁매트 테이블매트 방수,인테리어
맞춤 액자 프레임 알루미늄액자 대형 액자틀 보석십자수 원목 사이즈 주문제작,인테리어
오스람 LED전구 LED볼전구 8W 9W 10.5W 12W 13.5W 18W,인테리어
글루시 오로라 무드등 우주 은하수 우주인 조명 미러볼 집들이선물,인테리어
룸핏 무아 유아 책장 교구장 전면책장 거실 아기 낮은 2단 책꽂이 장난감정리장 수납장 선반장,인테리어
아라크네 알루미늄 블라인드 30 x 30,인테리어
"리우리빙 튼튼한 행거 조절식 2단부터 6단까지 블랙,블랙앤화이트 38mm 스탠드 옷걸이",인테리어
마켓비 MKB 캐비넷 모던세로중 2문 수납장 8001015,인테리어
남영전구 LED T5조명 간접조명 우물천장 커텐박스 신발장 플리커프리 5W 300mm,인테리어
고정밴드 여름 피그먼트이불 인견 알러지케어 순면누빔 침대패드 시어서커 매트리스패드,인테리어
가구의가치 오브제 전자 렌지 수납장 다이 선반 800,인테리어
LG하우시스 진양 두꺼운 모노륨 셀프 장판 시공 바닥 거실 대리석 베란다 LX,인테리어
아이코닉하우스 이지 원목 스탠드 옷걸이 행거,인테리어
초이’s 존마크 토퍼 ss 슈퍼싱글 1100 X 2000,인테리어
이케아 트롤리 RASKOG 로스코그 로스훌트 웨건 카트 화이트 38x28 cm,인테리어
파로마 블랑 원목 분리형 이층침대 가드 포함,인테리어
1+1 킹콩바나나 차르르 쉬폰커튼 거실 나비주름+안방커텐 화이트 암막커튼,인테리어
인조잔디 매트 옥상 베란다 테라스 시공 인공 롤,인테리어
무아스 3D 빅플러스 LED 벽시계,인테리어
이룸홈 거실 리프트 테이블 높이 조절 리프트업 쇼파테이블,인테리어
반디LED 공부 스탠드 집게형 독서 책상 조명,인테리어
헬로디노 러닝타워 키친헬퍼 접이식 높이조절 낙상방지,인테리어
빌트인 1000 홈카페장 주방 오브제 비스포크 홈카페수납장 틈새장 김치 냉장고장 팬트리장,인테리어
LED 투광기 투광등 30W 50w 70w 100w 간판조명 공장등 보안등 고천장등,인테리어
천일 CIV 타일카페트 조각 매트 베란다 사무실 거실 실내 바닥 인테리어 시공 카펫,인테리어
에이스침대 CA2 원매트리스 LQ,인테리어
[올리비아데코] 포근 부드러운 순면 광목 모달 워싱 간절기 여름 차렵이불 세트 (S/Q),인테리어
하이그로시 싱크대 주방 소형 사무실 원룸 상하부장 개수대 조리대,인테리어
리바트하움 듀얼모터 모션데스크 프로 1200,인테리어
김국산 여름 쿨매트 100% 듀라론 냉매트 냉감 통풍 쿨링 침대쿨패드,인테리어
까르엠가구 로렌 고무나무 원목 6인용 식탁 테이블,인테리어
스멀리드 의자 등받이 허리 쿠션 받침대 사무실,인테리어
순면누빔 알러지케어 고정밴드 냉감 여름침대패드 슈퍼싱글 퀸 라지킹 패밀리사이즈,인테리어
탑앤라이프 그랜드 - Z 조립식창고 농막 전원주택 이동식 야외,인테리어
빌트인 틈새장 키큰 주방 김치냉장고자리 오브제 비스포크 틈새 수납장 냉장고장 팬트리장,인테리어
업소용 테이블 업소 고기집 식당 불판 식탁 서랍 2인용 4인용 수저통 철제 식탁,인테리어
폴로까사 로한 4인용 아쿠아텍스 스웨이드 패브릭소파,인테리어
니뜰리히 메모리폼 원형 둥근 벤치 의자 식탁 방석 푹신한 1 딥그레이,인테리어
순면누빔 침대 매트리스커버 슈퍼싱글 퀸 킹 라지킹 패밀리 매트커버,인테리어
드리움 4인용 6인용 12mm통 포세린 세라믹식탁 식탁세트 24년,인테리어
힙톡 무타공 도어스토퍼 현관 말발굽 자석 말굽 현관문 방문 고정 일반/블랙 티톡,인테리어
풀레뜨 식물등 삼성 30 50 60 90 cm 식물led 제라늄 다육 주광색 30cm 생장등,인테리어
에이스침대 CA 원매트리스 DS,인테리어
이지씽크 LPM 모듈러싱크대 e0자재사용 조립완제품 택배배송 소형싱크대 사무실 원룸,인테리어
방수 알러지케어 향균 푹신푹신한 삼각등받이쿠션 소 중 대형 16컬러 침대 쇼파,인테리어
루나랩키즈 어린이 초등학생 바른자세 책상 스마트,인테리어
홈카페수납장 우드앤화이트 주방수납장 틈새장 냉장고장 부엌 팬트리장 홈카페장,인테리어
베스트리빙 캘빈 4인 세라믹 대리석 식탁 세트 벤치형 의자형,인테리어
시디즈 T90 하이엔드 컴퓨터 책상 의자 더블라셀 메쉬 HLDA,인테리어
[국산] 슬림 에코 LED 조명 T7 티라인 라인조명 레일조명 레일등 일자등 플리커프리,인테리어
이케아 트롤리 로스코그 로스훌트 무빙 카트 화이트 국민 기저귀정리함,인테리어
사각 우산 꽂이 우산통 보관통 15구,인테리어
만능풀바른벽지 초간단 셀프도배 실크,인테리어
누비홈 밴딩 베개커버 순면 누빔 사계절 덮개 베겟잎 밴드형 4060,인테리어
북유럽 패턴 현관 코일 매트 잘라쓰는 입구 베란다 입구 아파트 사무실 바닥 깔판,인테리어
철제수납장 마켓비 수납장 틈새 미니 캐비넷 이동식 수납 이케아 수납장 슬림 책상,인테리어
LED모듈 교체 삼성 기판 거실 주방 전등 자석 원형 리폼 국산 셀프 세트 안정기,인테리어
성진공간박스 MDF 국산자재 책장 책꽂이 책정리 틈새 자투리 공간활용 베란다 수납정리,인테리어
다용도선반 조립선반 수납선반 무볼트앵글 랙 경량렉 철제 선반장 제작,인테리어
아라크네 1+1 암막 우드블라인드 오동나무 원목 거실 베란다 창문 사무실,인테리어
누구나 아주쉽게 문짝교체 가능한 제품출시 ABS도어 방문 욕실문 화장실문 셀프시공,인테리어
하루의공간 소프트 규조토 발매트 화장실 욕실 주방 빨아쓰는 미끄럼방지,인테리어
오라이프샵 3type 웨이브 쇼파패드 매트 커버 극세사 미끄럼방지 논슬립 W01,인테리어
콤피라이프 모달원단 150cm 110cm 빨아쓰는 원형 롱 바디필로우 대형 쿠션 솜 포함,인테리어
가구의가치 굿모닝 원목 4인 식탁 세트 벤치 + 의자형,인테리어
더나은 기능성 치질방석 자세교정 꼬리뼈 골반 엉덩이 전립선 허리,인테리어
동서가구 피츠 댄디 5단 1200 A 오픈책장 PAC031,인테리어
쫀쫀한 메모리폼 토퍼 접이식 바닥이불 침대 캠핑 차박 매트리스(멀티/슈퍼 싱글/퀸),인테리어
시스템행거 드레스룸 옷걸이 조립식 행거 철제 선반 스탠드 옷장 커튼,인테리어
자바라 홀딩도어 자바라문 접이식문 투명 방염 중문 칸막이,인테리어
웰퍼니쳐 몬스터 사하라 아쿠아텍스 3인용 패브릭 소파,인테리어
베스트렉 아일랜드식탁 홈바의자 바 체어 높은 바스툴 바텐 빠,인테리어
다니카 블리스 다용도 사무실 다리거치대 의자 2단 발받침대,인테리어
루나랩 높이조절 스탠드 책상 모션데스크 거치형 800,인테리어
한샘 샘키즈 높은 수납장/책장 1305&870 모음,인테리어
리바트 뉴프렌즈 1200 책장 5단,인테리어
국산 웨건 서빙 카트 식당 업소용 주방 서빙카 트롤리 써빙카트 2단 3단 무소음 우레탄바퀴,인테리어
[바이소] 삼각 등받이 쿠션 허리 등 대형 침대 쇼파 H로고,인테리어
수납선반 다용도 제작 조립 무볼트 경량렉 팬트리 철제 모듈 랙 선반장,인테리어
마켓비 OLLSON 책상,인테리어
레일등 레일조명 LED 천장 천정 카페 등기구 셀프,인테리어
DIY 목재재단 합판 방부목 원목 자작 나무 멀바우 미송 레드파인 편백 상판 나무판 각재,인테리어
왕자행거 스탠드옷걸이 뉴허니폴 옷걸이,인테리어
돈들어오는 국산 무소음 벽시계 벽걸이시계 인테리어 해바라기 아트,인테리어
리빙인도무스 고흐 템바보드 거실장 2200,인테리어
LED 초슬림 무타공 엣지조명 거실등 국산 방등 주방조명 전등교체,인테리어
쿠셔니 벽지 폭 70cm 붙이는 벽지 스티커 접착식 단열 실크벽지,인테리어
나스파 루아 4단 원목 회전책장,인테리어
이코노미쿠스 앉은뱅이 접이식 등받이 좌식의자,인테리어
이지온 국민튼튼 드레스룸 행거 EO-406 선반 커튼 시스템 행거 모음,인테리어
[모노] 러그 거실 카페트 대형 단모 워셔블 거실러그,인테리어
깃든 알러지케어 나란히 사계절 차렵이불 SS,인테리어
토퍼 매트리스 침대 메모리폼 바닥이불 흙침대 접이식 요 누보레 오가닉 SS,인테리어
[무타공] 도어스토퍼 현관문 방문 고정 스토퍼 말발굽,인테리어
국산 삼성칩 LED모듈 리폼램프 전등교체 안정기일체형,인테리어
유리창문 안개시트지 무점착 불투명 반투명 망입 도트그라데이션 시선차단 오로라썬팅지 칼라,인테리어
이케아 오리털 덕다운 이불 이불커버 침구 세트 슈퍼싱글 퀸 킹,인테리어
시그니처 렌지대 3단 전자렌지 선반 수납장 진열장 밥솥 다,인테리어
알러지케어 고정밴드 순면누빔 침대패드 냉감 여름패드 피그먼트이불 극세사패드,인테리어
호레움 조립식창고 스틸창고 Compact 3X5 농막 간이 야외 미니 소형 이동식 창고,인테리어
사다리형 금속다리 철제테이블다리 책상 식탁 좌탁 벤치 A자 우드슬랩다리 프레임,인테리어
아우디 침대형의자 게이밍 개인방송 사무실 컴퓨터 책상 무중력의자,인테리어
마켓비 스툴의자 원목 이케아 스톨 라탄 스텝스툴 원형 낮은 미니 의자 보조 화장대,인테리어
꿈꾸다 원터치 철제 접이식 폴딩 선반 2단 3단 4단 5단 창고 다용도 이동식,인테리어
위니웰 고앵스 인테리어 화병 집들이선물 감성 소품 세라믹 북유럽 장식,인테리어
LED 방등 LED등 거실 조명 50W 전등 교체 국산 삼성칩,인테리어
아동 주니어 남매 성인 여아 2층 테라스 고무나무 LPM 벙커침대 목봉가드,인테리어
트리니홈 피크 홈카페 수납장 1200 비스포크 냉장고장 오브제 주방 다용도 틈새장 부엌 장식장 홈카페장,인테리어
시디즈 2단 발받침대 패딩형,인테리어
렉슨 미나M 미니조명 미니램프 LH64,인테리어
루나리스 led시계 사무실 벽걸이 디지털 전자 벽시계 캘린더 대형 개업선물 GPS,인테리어
스텐레스 방문손잡이 문고리 도어 문손잡이 현관문 목문 화장실 욕실 스텐 방문도어락 교체,인테리어
불붙지않는 에어컨 실외기 커버 열차단 절전 덮개,인테리어
알렉스 아일랜드식탁 바테이블 홈바 하이테이블 조리대 수납 베이킹작업대,인테리어
사계절 방수 쇼파패드 소파 토퍼 매트 카우치형 커버 주문제작,인테리어
3단 다용도 서빙카트 이동식 서빙카 주방카트 업소용 식당 (일반4p),인테리어
[LEXON]렉슨 MINA L 미나L 미니조명 미니램프 인테리어 무드등 - LH65,인테리어
