name,category
"라네즈 네오 쿠션 매트 15g + 리필 15g 세트, 21C1 쿨 베이지, 1세트",뷰티
"프로에잇청담 리퀴드 디파인 라이너 2.5ml, 브라운, 1개",뷰티
"이프너리 클리어 제모 스프레이, 150ml, 1개",뷰티
"메디필 레드 락토 콜라겐 랩핑 마스크팩 70ml, 1개입, 2개",뷰티
"닥터 브로너스 티트리 퓨어 캐스틸 솝 바디워시, 950ml, 1개",뷰티
"헤라 실키 스테이 24아워 롱웨어 파운데이션 30g SPF20, 23W1 샌드베이지, 1개",뷰티
"셀라피 에이리페어 크림, 50ml, 1개",뷰티
"바닐라코 커버리셔스 파워 핏 파운데이션 30ml, 21 아이보리, 1개",뷰티
"비플레인 녹두 약산성 클렌징폼 더블 세트, 160ml, 1세트",뷰티
"이니스프리 New 그린티 씨드 히알루론산 세럼, 1개, 80ml",뷰티
"지저쓰 오리지널핑크 워머기키트W, 200g, 1세트",뷰티
"포뷰트 웨트 폴리쉬 헤어오일, 160ml, 1개",뷰티
"김정문알로에 큐어 플러스 크림 80g x 2p + 큐어2X 미니 3.5g x 2p + 클렌저 2ml x 3p 세트, 1세트",뷰티
"비플레인 녹두 클렌징 오일 증량 기획세트, 240ml, 1세트",뷰티
"다슈 프로 에어리 폴리쉬 오일, 100ml, 1개",뷰티
"코리아나 앰플엔 세라마이드샷 앰플 대용량, 100ml, 1개",뷰티
"라네즈 크림스킨, 170ml, 1개",뷰티
"제이엠솔루션 액티브 솔루션 마스크팩 4종 x 10p 세트, 40매, 1세트",뷰티
"비플레인 녹두 약산성 클렌징폼 더블 세트, 160ml, 2세트",뷰티
"바닐라코 클린 잇 제로 트래블 오리지널 키트 클렌징밤, 12ml, 4개",뷰티
"도브 센스티브 뷰티바 비누, 75g, 12개",뷰티
"에스트라 아토베리어365 크림 플러스, 90ml, 1개",뷰티
"더랩바이블랑두 올리고 히알루론산 5000 토너, 300ml, 1개",뷰티
"와이츄 파워업 셀프 속눈썹펌 키트 시즌2 10종 실속세트 10회분, 1세트",뷰티
"데일리원더 헤어 핌 매직 스프레이 스트레이트너, 1개, 150ml",뷰티
"박준뷰티랩 프리미엄 홈케어 헤어 미용가위 16cm, 실버, 1개",뷰티
"쿤달 쿨 앤 클리어 아이스 부스팅 쿨 바디워시 아쿠아민트향, 1058ml, 1개",뷰티
"라운드랩 1025 독도 수분 크림 50ml 듀오 세트, 2개",뷰티
"웰라쥬 리얼 히알루로닉 블루 앰플, 100ml, 1개",뷰티
"이니스프리 블랙티 유스 인핸싱 앰플 대용량 세트, 70ml, 1개",뷰티
"조성아TM 코코밀크 크림 SPF50 PA++++, 아이보리 1호, 50g, 1개",뷰티
"프리메라 바하 버블 필링 클렌저, 1개, 200ml",뷰티
"마르시끄 인리치드 속눈썹 블랙 영양제, 1개, 7.5ml",뷰티
"에스트라 아토베리어 365 로션 플러스, 1개, 180ml",뷰티
"제이숲 퍼플제이 아쿠아마린 노워시 헤어팩 트리트먼트 200ml+30ml+15ml, 1세트",뷰티
"프리메라 페이셜 마일드 필링 150ml, 1개",뷰티
"닥터에이지 시카 히알루로닉 카밍 앰플, 35ml, 2개",뷰티
코시에로 젤러시 플럼퍼 7종 택 1 | 올리브영,뷰티
"나드 여행용 헤어바디 5종+매쉬파우치, 1세트",뷰티
"마녀공장 퓨어 클렌징 오일, 400ml, 1개",뷰티
"끌레드벨 프레스티지 골드 콜라겐 기초 토너 + 로션 + 세럼 + 크림 세트, 1세트",뷰티
"AHC 세이프온 마일드 선쿠션 SPF50+ PA++++, 25g, 1개",뷰티
"닥터지 브라이트닝 비타 필링 패드 70매, 1개",뷰티
"브라운 라이프 대용량 저자극 모찌 버블 핸드워시 베이비파우더향, 500ml, 2개",뷰티
"김정문알로에 큐어 인텐시브 2X크림 50g x 2p, 100g, 1세트",뷰티
"프로버블리 어성초 천연 중성비누, 110g, 10개",뷰티
"인클리어 의료기기 질세정기 10p, 17g, 1개",뷰티
"에뛰드 순정 디렉터 수분 선크림 SPF50+ PA++++ 50ml + 20ml 기획세트, 70ml, 1세트",뷰티
"에스엔피 골드 콜라겐 아이 패치, 60개입, 1개",뷰티
"디오넬 시크릿 러브 블랙 에디션, 1개, 5ml",뷰티
"바이오더마 센시비오 H20 민감용 500ml + 250ml, 1개",뷰티
"메디플라워 모델링 콜라겐 마스크팩, 1개입, 1개",뷰티
"제이숲 단백질 헤어팩 트리트먼트, 1000g, 1개",뷰티
"달바 워터풀 톤업 선크림 SPF 50+ PA++++ 50ml x 2p + 약산성 젤클렌저 15ml 세트, 1세트",뷰티
"아던샵 셀프 속눈썹펌 세트, 복숭아향, 1세트",뷰티
"쿤달 시그니처 퍼퓸 앤 모이스처 라이징 비누 스위트 피오니향, 10개, 100g",뷰티
"다슈 데일리 두피 쿨링 스칼프 스프레이, 1개, 200ml",뷰티
"닥터에이지 시카 리페어크림, 50ml, 2개",뷰티
"이니스프리 포레스트 포어 케어 올인원 에센스, 1개, 100ml",뷰티
"헤라 멜라솔브 프로그램 딥 클렌징 폼, 200ml, 1개",뷰티
"쿤달 퓨어 바디워시 바디클렌저 체리블라썸향, 1058ml, 2개",뷰티
"마녀공장 비피다 바이옴 앰플 토너, 500ml, 1개",뷰티
"폴메디슨 판텔라 제모왁싱크림 모든부위용, 160ml, 2개",뷰티
"마녀공장 퓨어 클렌징 오일 250ml + 딥 클렌징 폼 100ml 세트, 1세트",뷰티
"비달사순 토르말린 세라믹 이온 에어스타일러 VSAS80PIK, 블랙",뷰티
"맥스클리닉 히알루론 비타 오일 폼, 110g, 1개",뷰티
"도브 딥플리 너리싱 바디워시, 2개, 950ml",뷰티
"플루 오리지널 바디스크럽 화이트머스크, 200g, 2개",뷰티
"일리윤 울트라 리페어 로션, 528ml, 1개",뷰티
"다슈 맨즈 멀티 커버 스틱 파운데이션 SPF50+ PA++++ 23호-24호 12g, 02 뉴트럴베이지, 1개",뷰티
"은율 내츄럴 콜라겐 마스크팩, 1개입, 50개",뷰티
"AHC 바이탈 골든 콜라겐 유스 토탈 케어 세트 + 쇼핑백, 1세트",뷰티
"메리쏘드 모공착 스틱 프라이머 10g, 1개",뷰티
"제이엠솔루션 마스크팩 꿀광 10p + 링거 물광 10p + 청광 10p 세트, 1세트",뷰티
"헤라 크리미 클렌징 폼, 200g, 1개",뷰티
"니베아 데오드란트 스프레이 드라이 컨피던스, 1개, 250ml",뷰티
"AHC 슈프림 리얼 포 페이스 아이크림, 30ml, 2개",뷰티
"일리윤 세라마이드 아토 집중 크림 무향, 500ml, 1개",뷰티
"박준뷰티랩 LPP 단백질 트리트먼트 헤어팩, 1000ml, 2개",뷰티
"닥터에이지 시카 진정 필링패드, 120ml, 2개",뷰티
"랩시리즈 데일리 레스큐 워터 로션, 200ml, 1개",뷰티
"모레모 딜라이트풀 고영양 헤어 에센스 오일, 150ml, 1개",뷰티
"헤라 블랙 쿠션 리필 15g, 23N1, 1개",뷰티
"제이숲 퍼플제이 단백질 노워시 헤어팩 트리트먼트, 200ml, 1개",뷰티
"뷰티레시피 스노우화이트 멜라 스탑 화이트닝 크림, 80ml, 1개",뷰티
"헤라 UV프로텍터 톤업 선크림 SPF50+ PA++++, 50ml, 1개",뷰티
"해피바스 오리지널 컬렉션 바디워시 솝라벤더향, 910g, 2개",뷰티
"은율 내츄럴 마스크팩 알로에 10p + 콜라겐 10p + 진주 10p + 히알루론 10p + 아보카도 10p, 50매, 1세트",뷰티
"미구하라 울트라 화이트닝 퍼펙트 앰플, 50ml, 1개",뷰티
"맥스클리닉 퓨리티톡 브라이트닝 클렌징 오일폼, 310g, 1개",뷰티
"뷰티레시피 스노우화이트 멜라 스탑 화이트닝 크림, 80ml, 2개",뷰티
"메디필 엑스트라 슈퍼 9 플러스 2.0, 250ml, 1개",뷰티
"부케가르니 바디미스트 베이비파우더향, 145ml, 2개",뷰티
"라운드랩 독도 토너 500ml + 로션 200ml 세트, 1세트",뷰티
"헤라 블랙 쿠션 15g, 21N1, 1개",뷰티
"뷰렌드 순면 멸균 나무 면봉, 20개, 100개입",뷰티
"제이숲 실크케라틴 단백질 샴푸, 1000g, 1개",뷰티
"에이지투웨니스 시그니처 에센스 커버 팩트 인텐스 케이스 1개 + 리필 2개, 21호, 1세트",뷰티
"바이오더마 센시비오 클렌징 H2O 500ml x 2p + 100ml, 1세트",뷰티
"닥터지 브라이트닝 필링젤 120g + 60g x 2p, 1세트",뷰티
"지저쓰 슈가링 왁싱키트, 350g, 1개",뷰티
"헤라 블랙 쿠션 리필 15g, 21C1, 1개",뷰티
"코스알엑스 하이드리움 그린티 아쿠아 수딩 젤 크림, 50ml, 1개",뷰티
"에스네이처 아쿠아 스쿠알란 수분크림, 60ml, 1개",뷰티
"에템 리얼시카 필 오프 팩 100g, 1개, 1개",뷰티
"아크로패스 대용량 패치 24p + 스킨 클렌저 12p 세트, 1세트, 1세트",뷰티
"무로 맨즈 안티브이 올인원 왁싱크림, 1개, 160ml",뷰티
"에이플던 뉴센 손톱영양제, 10ml, 1개",뷰티
"미쟝센 퍼펙트 오리지널 세럼 7X 샴푸, 680ml, 3개",뷰티
"뉴트로지나 인텐스 리페어 시카 에멀젼 바디로션, 2개, 450ml",뷰티
"부쉬맨 워터프루프 프로 선크림 SPF50+ PA++++, 50g, 1개",뷰티
"코스노리 화이트닝 드레스 톤업크림, 50ml, 1개",뷰티
"도브 화이트 피치 바디워시, 2개, 1L",뷰티
"폴메디슨 시그니처 대용량 퍼퓸 바디로션 화이트머스크향, 1077ml, 2개",뷰티
"로레알파리 엑셀랑스 크림 염색제, 6.30호 밝은갈색(황금빛), 2개",뷰티
"케라셀네일, 1개, 10ml",뷰티
"티스 딥 오프 클렌징 오일, 280ml, 2개",뷰티
"쿤달 쿨링 남성청결제 베르가못향, 300ml, 2개",뷰티
"은율 내츄럴 알로에 마스크팩, 50개입, 1개",뷰티
"청담스타일 포레스트 더 살롱 컬러 골드라벨 순수 염모제, 밀크브라운, 5개",뷰티
"플리프 시카 알로에 카밍 올인원, 200ml, 1개",뷰티
"팬틴 콜라겐 극손상케어 트리트먼트 220ml x 3p + 헤드앤숄더 딥클린 샴푸 90ml 세트, 1세트",뷰티
"다슈 아쿠아 딥 씨 워터 폼클렌징, 150ml, 3개",뷰티
"아유아유 올케어 제모 스프레이, 150ml, 1개",뷰티
"폴메디슨 옴므 대용량 올인원 바디워시 페로몬향 510ml, 2세트",뷰티
"도브 화이트 뷰티바 비누, 75g, 12개",뷰티
"도브 라벤더 하이드레이션 바디워시 라벤더향, 1L, 2개",뷰티
"노헤어크루 남성용 제모인티메이트 크림 포바디, 100ml, 1개",뷰티
"AHC 마스터즈 에어 리치 선스틱 SPF50+ PA++++, 14g, 2개",뷰티
"포르맨즈 쿨클린존 아이스 남성청결제, 150ml, 1개",뷰티
"제이숲 블랙제이 프로페셔널 클리닉 LPP 단백질 트리트먼트, 1000g, 1개",뷰티
"달바 화이트 트러플 퍼스트 스프레이 세럼 100ml 2개 + 약산성 젤 클렌저 15ml, 1세트",뷰티
"박준뷰티랩 LPP 단백질 트리트먼트 헤어팩 화이트 머스크, 1000ml, 1개",뷰티
"나드 부케가르니 트리트먼트 시그니처, 1000ml, 1개",뷰티
"일리윤 히알루론 모이스춰 수분크림, 100ml, 2개",뷰티
"AHC 온리포맨 스킨케어 2종 + 쇼핑백 세트, 1세트",뷰티
"에스트라 아토베리어365 하이드로 에센스, 150ml, 1개",뷰티
"모레모 노워시 바르는 트리트먼트 리커버리 밤 B, 120ml, 1개",뷰티
"바닐라코 클린 잇 제로 클렌징밤 오리지널, 180ml, 2개",뷰티
"헤드스파 7 더 프리미엄 트리트먼트, 210ml, 2개",뷰티
"오엘라 충전식 휴대용 코털 제거기 OB-NR02BK, 블랙",뷰티
"포미엔느 프로바이오틱스 여성 청결제 30개입, 54g, 1개",뷰티
"입큰 오리지널 퍼퓸 파우더 팩트 20g, 21호 누드베이지, 1개",뷰티
"닥터지 브라이트닝 업 선 플러스 SPF50+ PA+++, 2개, 35ml",뷰티
"아이오페 히아루로닉 스페셜 2종, 1세트",뷰티
"메디필 레드 락토 콜라겐 클리어 2.0 클렌징폼, 2개, 120ml",뷰티
"세븐피엠 셀프 볼륨 매직 스트레이트 퍼플에디션, 1개, 100ml",뷰티
"닥터지 그린 마일드 업 선 플러스 SPF50+ PA++++, 35ml, 2개",뷰티
"헤드스파 7 더 프리미엄 트리트먼트, 210ml, 3개",뷰티
"히든 퍼퓸 바디로션 보습 스프레이, 250ml, 1개",뷰티
"크리스탈 바디 데오드란트 스틱, 120g, 1개",뷰티
"다슈 여성용 데일리 라이트 핏 커버 니플밴드 65mm 20p, 1개",뷰티
"크리스탈클라우드 전동 눈썹정리기 CC-609, 화이트",뷰티
"와더스킨 퓨어미 약알칼리성 폼클렌징, 500g, 1개",뷰티
"라온 블랙 아르간 헤어오일, 2개, 250ml",뷰티
"달바 워터풀 에센스 선크림 SPF50+PA++++ 50ml 2개 + 약산성 젤 클렌저 15ml, 1세트",뷰티
"나드 여드름 완화 바디워시, 1개, 1000ml",뷰티
"Z6 12 LED UV 조개 젤네일 램프, 혼합색상, 1개",뷰티
"메디플라워 모델링 팩 쿨, 1개입, 1개",뷰티
"라피타 IPL 자동조사 레이저 제모기 혼합색상, JOC-9000",뷰티
"일리윤 세라마이드 아토로션 무향, 528ml, 1개",뷰티
"헤라 선 메이트 데일리 선블록 SPF35 PA+++, 70ml, 1개",뷰티
"듀오덤 스팟패치, 60개입, 2개",뷰티
"바렌 양면 스텐 프로 어메이징 풋 발각질 제거기, BAREN / F01, 1개",뷰티
"제이숲 스타일제이 볼륨 마스터 셀프 앞머리 펌 1제 10ml x 5p + 2제 50ml 세트, 100ml, 1세트",뷰티
"필립스 6000 시리즈 바디 제모기 화이트 + 그레이, BRL126/00",뷰티
"쿤달 데오드란트 스프레이 베이비파우더향, 150ml, 2개",뷰티
"닥터방기원 랩 탈모 기능성 헤어트리트먼트, 1000ml, 2개",뷰티
"모이스올가 프리미엄 유기농 화장솜, 100개입, 4개",뷰티
"닥터지 레드 블레미쉬 시카 수딩 크림, 100ml, 1개",뷰티
"센카 퍼펙트 휩 프레시 클렌징 폼, 100g, 3개",뷰티
"입큰 스킨피니쉬 팩트 파우더 + 리필, 21호 누드베이지, 1세트",뷰티
"에이지투웨니스 샤이닝드롭 팩트 에디션 케이스 + 리필 12.5g x 3p, 21호(핑크라떼), 1세트",뷰티
"나드 부케가르니 트리트먼트 시그니처, 1000ml, 2개",뷰티
"비오투름 클렌징 밀크, 500ml, 1개",뷰티
"닥터지 레드 블레미쉬 시카 수딩 토너 200ml + 에센스 플루이드 150ml 세트, 1세트",뷰티
"메디힐 더블 카밍 워터 마스크 10p +히알루 모이스트 에센스 마스크 10p +펩타 리프팅 앰플 마스크 10p, 10개입, 1세트",뷰티
"다슈 클래식 대용량 볼륨 그루밍 토닉 워터 헤어왁스, 400ml, 1개",뷰티
"아던샵 셀프 속눈썹펌 3회분 세트, 1세트",뷰티
"부케가르니 바디워시 화이트머스크, 1000ml, 2개",뷰티
"썸머스이브 데일리 밸런스 페미닌 워시 여성청결제, 237ml, 1개",뷰티
"다슈 컬러 패스트 체인지 새치전용 염색제, 흑갈색, 2개",뷰티
"헤라 블랙 쿠션 리필 듀오 15g x 2p, 21N1, 2개",뷰티
"에뛰드하우스 순정 약산성 6.5 휩 클렌저, 1개, 250ml",뷰티
"방탄꼭지 스킨엔진 에어 니플밴드 35mm, 60매",뷰티
"존바바토스 아티산 EDT 125ml + 퍼퓸케이스, 1개",뷰티
"OBge 내추럴 커버 파운데이션 SPF50+ PA++++ 13g, 3호 샌드, 1개",뷰티
"셀리맥스 어성초 BHA 지우개 필링 패드 60p, 60매입, 2개",뷰티
"헤라 블랙 쿠션 리필 15g, 21N1, 1개",뷰티
"은율 데일리 케어 선스틱 플러스 SPF 50+ PA++++, 23g, 2개",뷰티
"폴메디슨 시그니처 바디미스트 화이트머스크향, 211ml, 2개",뷰티
"마녀공장 허브 클렌징 오일, 200ml, 1개",뷰티
"비타할로 핑크 하드왁스 (모든 부위용), 2개입, 200g",뷰티
"존바바토스 아티산 EDT, 75ml, 1개",뷰티
"에이지투웨니스 시그니처 에센스 커버 팩트 인텐스 케이스 1개 + 리필 2개, 23호, 1세트",뷰티
"닥터방기원 시카마이드 블레미쉬 카밍 올인원, 300ml, 1개",뷰티
"해피바스 주스스무디 옐로우 바디워시, 820g, 2개",뷰티
"바렌 발각질지우개 각질연화제 + 각질지우개 풋 파일 세트, 1세트",뷰티
"루나 프로 포토 피니셔 파우더 팩트, 2호 블러 파우더, 1개",뷰티
"셀퓨전씨 레이저 썬스크린 100 SPF50+ PA+++ 45ml x 2p + 10ml, 1세트",뷰티
"미스사사 슈퍼 쿨링 파우더 시트 데오드란트 클린솝 15매, 5개",뷰티
"폴메디슨 시그니처 대용량 퍼퓸 바디워시 화이트머스크향, 1077ml, 2개",뷰티
"부케가르니 나드 바디워시 라벤더머스크, 1000ml, 2개",뷰티
"다슈 데일리 안티 헤어로스 헤어쿠션 26g, 내추럴 블랙, 1개",뷰티
"헤라 옴므 스킨 하이드로 트리트먼트 올인원 150ml, 1세트",뷰티
"유리아쥬 스틱레브르 오리지널 립밤 4g + 제모스 스틱레브르 무향 립밤 4g 듀오, 1세트, 립밤 오리지널 + 립밤 제모스",뷰티
"본트리 베리 에센스 선블럭 SPF50+ PA++++, 50ml, 2개",뷰티
"미쟝센 쉽고 빠른 거품 염색 새치전용, 2N(흑색), 4개",뷰티
"더프트앤도프트 퍼퓸드 바디워시 소피소피, 1020ml, 1개",뷰티
"라네즈 네오 쿠션 매트 리필 15g, 21C1, 1개",뷰티
"이니스프리 히알루론 수분 선크림 SPF50+ PA++++, 1개, 50ml",뷰티
"제이숲 딥그린제이 아로마 약산성 비건 바디워시 프렌치 라벤더, 1000ml, 1개",뷰티
"부케가르니 나드 약산성 버블 클렌징폼, 500ml, 2개",뷰티
"멈칫 대용량 섬유향수 소프트 블루솝 250ml, 소프트블루솝, 2개",뷰티
"미샤 비타씨플러스 잡티씨 탄력앰플, 40ml, 1개",뷰티
"아이오페 맨 올데이 퍼펙트 올인원, 120ml, 1개",뷰티
"OBge 내추럴 커버 파운데이션 SPF50+ PA++++ 13g, 1호 아이보리, 1개",뷰티
"아이오페 맨 프로 레티놀 올인원, 1개, 120ml",뷰티
"김정문알로에 라 센스 로에 큐어 워터 스플래쉬 쿨링 선스틱 SPF50+ PA++++, 3개, 23g",뷰티
"미바 왕쿠션 시즌2 본품 25g + 리필 25g x 2p 세트, 21호 화사한피부, 1세트",뷰티
"밀크바오밥 헤어트리트먼트 화이트머스크향, 1L, 2개",뷰티
"존바바토스 아티산 블루 EDT, 1개, 125ml",뷰티
"다슈 맨즈 듀얼 트릭 스틱 3.4g, 혼합색상, 1개",뷰티
"닥터포헤어 폴리젠 씨 솔트 헤어 스케일러, 300g, 1개",뷰티
"페이스팩토리 전동 UV 충전형 발각질제거기 FF-17, 혼합색상",뷰티
"미샤 타임 레볼루션 나이트리페어 앰플 5X, 1개, 70ml",뷰티
"뷰카 클래식 어성초 블랙 차콜 비누 레몬버베나향, 100g, 10개",뷰티
"NEW 오딧세이 로맨틱 스페셜 2종 세트, 1세트",뷰티
"아넷스토어 럭셔리한 글라스 풋파일 골드, 1개",뷰티
"쿤달 퓨어 바디워시 베이비파우더향, 1058ml, 2개",뷰티
"폴메디슨 딥레드 대용량 올인원 폼클렌징 510ml, 2개",뷰티
"미쟝센 살롱 10 에센스 팩 극손상 모발용, 990ml, 1개",뷰티
"이지덤 퀵카밍, 4개입, 3개",뷰티
"제이숲 레드제이 힐링픽서 플러스 헤어 스프레이, 200ml, 1개",뷰티
"미쟝센 헬로크림 염색제, 10WC 웜코랄, 2개",뷰티
"마녀공장 퓨어 클렌징 밀크, 200ml, 1개",뷰티
"바세린 어드벤스드 리페어 로션, 400ml, 2개",뷰티
"일리윤 세라마이드 아토로션 무향, 528ml, 2개",뷰티
"OBge 내추럴 커버 파운데이션 SPF50+ PA++++ 13g, 2호 베이지, 1개",뷰티
"포인트앤 딥클린 올인원 클렌징티슈, 80매, 2개",뷰티
"포뷰트 드롭셋 남자 옆머리누르기 다운펌기계, 네이비, 1개",뷰티
"일리윤 세라마이드 아토 6.0 탑투토워시, 500ml, 2개",뷰티
"쏘내추럴 올 데이 메이크업 픽서, 100ml, 1개",뷰티
"에스쁘아 워터 스플래쉬 세라마이드 선크림 SPF50+ PA++++, 60ml, 1개",뷰티
"한스킨 클렌징오일 앤 블랙헤드 PHA, 1개, 300ml",뷰티
"부케가르니 나드 UV 쉴드 선크림 SPF50+ PA++++, 50ml, 2개",뷰티
"라운드랩 독도 토너 200ml + 로션 200ml 세트, 1세트",뷰티
"닥터방기원 나노 버블 클렌징폼, 2개, 200ml",뷰티
"이니스프리 비자 바하 트러블 토너, 170ml, 1개",뷰티
"라운드랩 독도 토너, 500ml, 1개",뷰티
"바른생각 젤 스탠다드, 150ml, 1개",뷰티
"뷰카 눈치제로 니플 커버 패치 98p, 1개",뷰티
"다슈 맨즈 아쿠아 딥 워터풀 올인원 로션, 2개, 153ml",뷰티
"닥터포헤어 폴리젠 플러스 샴푸, 500ml, 2개",뷰티
"쿤달 허니 앤 마카다미아 트리트먼트 베이비파우더향, 1058ml, 2개",뷰티
"헤드앤숄더 프로페셔널 안티 댄드러프 어드밴스드 오일 컨트롤 샴푸, 300ml, 1개",뷰티
"츠바키 프리미엄 EX 리페어 마스크, 180g, 1개",뷰티
"제이숲 스타일제이 포맨 슈퍼 하드 매트 왁스, 120g, 1개",뷰티
"피카소 함경식 프리미엄 메이크업 스파츌라 기획세트, 1세트, 혼합색상",뷰티
"은율 데일리 케어 콜라겐 미스트, 100ml, 3개",뷰티
"비바스 맥주효모 2X 컬링 에센스, 150ml, 2개",뷰티
"일리윤 세라마이드 아토 6.0 탑투토워시, 1000ml, 1개",뷰티
"라로슈포제 NEW 시카플라스트 밤 B5+ 크림, 40ml, 1개",뷰티
"토니모리 원더 아쿠아 수분크림, 300ml, 1개",뷰티
"폴메디슨 판텔라 왁싱크림, 160ml, 1개",뷰티
"미프 비타맥스 남성용 올인원 로션 본품 200ml + 리필 150ml, 1세트",뷰티
"에뛰드하우스 더블래스팅 리퀴드 파운데이션 30g, 1개, 뉴트럴베이지",뷰티
"NEW 오딧세이 블랙 스페셜 2종 세트, 1개",뷰티
"아토99 피부 건조 가려움 케어 편백수 사이프러스 크림, 1개, 200ml",뷰티
"바닐라코 프라임 프라이머 피니쉬 팩트 6.5g, 투명, 1개",뷰티
"코스노리 롱 액티브 아이래쉬 세럼 속눈썹 영양제, 9g, 1개",뷰티
"에스쁘아 프로 테일러 비 벨벳 커버 쿠션 13g + 퍼프, 21호 아이보리, 1세트",뷰티
"다슈 컬러 패스트 체인지 새치전용 염색제, 흑색, 2개",뷰티
"바닐라코 클린 잇 제로 클렌징밤 오리지널, 180ml, 1개",뷰티
"셀퓨전씨 스틱 썬스크린 100 SPF50+ PA++++, 19g, 1개",뷰티
"리무브 스킨브라 클래식 니플커버 실리콘 니플패치 니플밴드, 1개",뷰티
"미샤 포맨 익스트림 리뉴 스킨 + 로션 2종 세트, 1세트",뷰티
"리코셀 촉촉 순한 마스크팩 10종 x 10p 세트, 100매, 1세트",뷰티
"더블유드레스룸 퍼퓸 핸드크림 No 97 에이프릴코튼, 50ml, 2개입",뷰티
"AMAPO 실리콘 니플 패치 스킨 12p + 틴케이스 세트, 1세트",뷰티
"머지 더 퍼스트 브로우 펜슬 0.3g, B2 피칸 브라운, 2개",뷰티
"닥터지 레드 블레미쉬 포 맨 올인원 플루이드, 150ml, 1개",뷰티
"닥터방기원 댄드러프 비듬케어 탈모샴푸, 1000ml, 1개",뷰티
"마몽드 로즈워터 토너, 1개, 500ml",뷰티
"닥터방기원 쿨 탈모 샴푸, 1000ml, 2개",뷰티
"바이오옵틱스 아이클린 리드클리너 눈꺼풀세정제 30p, 1개, 60ml",뷰티
"마녀공장 비피다 바이옴 앰플 패드 70p, 70매, 1개",뷰티
"나드 스타일링 볼륨 헤어스프레이, 200ml, 1개",뷰티
"참존 인진쑥 디 오리지널 스킨 + 로션 세트, 2세트",뷰티
"글램모먼트 포맨 스킨 핏 커버 패치 니플밴드 60p, 2개",뷰티
"제이숲 스타일제이 포맨 퍼펙트 세팅 워터 헤어 스프레이, 1개, 200ml",뷰티
"머지 더 퍼스트 펜 아이라이너 0.5g, 오레오, 2개",뷰티
"AHC 더블쉴드 선스틱 SPF50+ PA++++ 14g x 3p + 선크림 50ml 세트, 1세트",뷰티
"제이숲 스타일제이 포맨 셀프 다운펌 펌브러쉬 + 집게 + 장갑 + 펌지 세트, 1개, 120ml",뷰티
"나드 핸드워시 라벤더 머스크, 280ml, 3개",뷰티
"그라펜 트리플 핸섬 남성 립밤 4.3g, 혼합색상, 1개",뷰티
"시세이도 아이래쉬 컬러, 혼합색상, 1개",뷰티
"셀퓨전씨 포스트알파 쿨링패드 70p, 70개입, 1개",뷰티
"니베아 데오드란트 롤온 엑스트라 브라이트, 50ml, 2개",뷰티
"그라펜 해수 포마드 헤어왁스, 1개, 100g",뷰티
"델리뷰티 퍼펙트 베이스젤 10ml + 논와이프 탑 젤 10ml 세트, 혼합 색상, 1세트",뷰티
"다슈 쿨링 데오 풋스프레이 발냄새제거제, 1개입, 1개",뷰티
"부케가르니 슈가 바디스크럽 화이트머스크향, 500g, 1개",뷰티
"닥터지 레드 블레미쉬 클리어 수딩 토너, 300ml, 1개",뷰티
"리우젤 코리아 그루밍 토닉, 1개, 350ml",뷰티
"폴메디슨 옴므 워터화이트닝 스킨로션 올인원 에센스, 211ml, 2개",뷰티
"부케가르니 나드 바디워시 라벤더머스크, 1000ml, 1개",뷰티
"나드 바디로션 라벤더머스크, 1000ml, 1개",뷰티
"케라시스 러블리 앤 로맨틱 퍼퓸샴푸 꽃향, 980ml, 3개",뷰티
"무로 양면 스텐 초강력 휴대용 발각질 제거기 블랙, 1개, 1개입",뷰티
"아이오페 UV쉴드 선 프로텍터 XP SPF50+ PA++++, 60ml, 1개",뷰티
"토니모리 더 촉촉 그린티 수분 2종 세트, 1세트",뷰티
"씨드비 프리미엄 물염색 시즌2 4회분, 미디엄브라운, 1개",뷰티
"퍼플고릴라 강력한 멀티트리머, Purple Gorilla-TN588",뷰티
"다슈 데일리 라이트 핏 선젤 50+ PA++++, 50ml, 1개",뷰티
"리우젤 코리아 그루밍 토닉, 1개, 100ml",뷰티
"다슈 클래식 볼륨 그루밍 토닉 워터 왁스, 200ml, 1개",뷰티
"바버501 쉐이빙부스터 스무디 시카, 300ml, 1개",뷰티
"일리윤 세라마이드 아토 버블워시 앤 샴푸, 400ml, 1개",뷰티
"롬앤 베러 댄 아이팔레트, 06 피오니 누드 가든, 1개",뷰티
"코멧 홈 고급 쪽집게 핀셋 3종 세트, 혼합색상, 1세트",뷰티
"탐사 라벤더 에센셜 비누, 90g, 20개",뷰티
"세븐피엠 매직모히칸 헤어소품, 1개",뷰티
"팬틴 극손상케어 컨디셔너, 1800ml, 1개",뷰티
"라보에이치 프로바이오틱스 탈모 증상 완화 샴푸 두피강화, 400ml, 1개",뷰티
"린제이 프리미엄 티트리 모델링팩 1kg, 1개입, 1개",뷰티
