name,category
"생활공작소 라텍스 밴드형 고무장갑 양손 세트, 그레이, 중(M), 3세트",생활용품
"바디럽 퓨어썸 샤워기, 1개, 혼합색상",생활용품
키친아트 5단 식품건조기 KNT-202,생활용품
"락앤락 쉐이킷보틀 프로 스테인리스, 라이트그레이, 650ml",생활용품
"테팔 트렌디쿡 인덕션 프라이팬, 1개, 28 cm",생활용품
"글래드 매직랩 일반형, 3개",생활용품
"한스킨 클렌징오일 앤 블랙헤드 PHA, 1개, 300ml",생활용품
"5분 바로 밥 누룽지 가마솥 손잡이형 + 나무 세트 + 계량컵, 0.8L, 은색, 검정색",생활용품
"잘풀리는집 3겹 맥스소프트 화장지 30m, 1개, 30롤",생활용품
"퀸센스 올스텐 잔치팬, 1개, 34cm",생활용품
"네스카페 돌체구스토 아메리카노 캡슐커피, 7.9g, 16개입, 3개",생활용품
"비트 진드기 액체세제 드럼용 리필, 2L, 4개",생활용품
"락앤락 DOSILOCK 프로페셔널 3단 도시락 360ml + 530ml, 옐로우, 1개",생활용품
"탐사 천연펄프 핸드타올, 5000매, 1박스",생활용품
"탐사 1겹 천연펄프 점보롤 400m, 16롤, 1팩",생활용품
"마더센트 싱크대 수도꼭지 녹물필터헤드 코브라 타입 호환 필터 헤드 + 리필 필터 7p 세트, 1세트",생활용품
"블랑101 고농축 유아섬유유연제 시그니처향 본품, 1개, 1.6L",생활용품
"이지엔 슬라이더 지퍼백, 대(L), 60개입, 1개",생활용품
"코멧 니트릴장갑 화이트, 대(L), 200매, 1개",생활용품
"박준뷰티랩 LPP 단백질 트리트먼트 헤어팩, 1000ml, 2개",생활용품
"사가미 오리지널 002, 12개입, 1개",생활용품
"비트 진드기 액체세제 드럼용 리필, 2L, 4개",생활용품
"메디필 엑스트라 슈퍼 9 플러스 2.0, 250ml, 1개",생활용품
"코멧 니트릴장갑 블랙, 대(L), 200개, 1개",생활용품
"시크릿데이 러브 중형 16p x 3팩 + 대형 14p x 2팩 + 오버나이트 10p, 1세트",생활용품
"베베숲 저자극 제로 물티슈 캡형, 80매, 10팩",생활용품
"다우니 퍼퓸 쥬얼 자수정 베리 향기 부스터, 480g, 2개",생활용품
"잘풀리는집 맥스 다용도 키친타올 250매, 12개, 250개입",생활용품
"락앤락 로즈골드 IH 인덕션 후라이팬, 28cm, 1개",생활용품
"락앤락 비스프리 모듈러 정사각 600ml, 4개입, 단품",생활용품
"한스킨 클렌징오일 앤 블랙헤드 PHA, 1개, 300ml",생활용품
"도루코 페이스7 2 프레쉬 면도기 본체 + 면도날 11p 세트, 면도기 + 면도날 11p, 1세트",생활용품
"브라운 라이프 초강력 빠른 제습제, 525ml, 24개",생활용품
"미쟝센 퍼펙트 오리지널 세럼 샴푸 7X 플로럴향, 900ml, 2개",생활용품
"코멧 홈 물걸레 청소포 대형 리필 30매, 10팩",생활용품
"메쉬넵2 네블라이저 HL-100A, 1세트",생활용품
"피죤 레귤러 섬유유연제 핑크로즈 리필, 2.3L, 6개",생활용품
"스타벅스 하우스블렌드 캡슐커피, 8.5g, 12개입, 4개",생활용품
"2023 하기스 네이처메이드썸머 점보형 6단계 팬티형 남여공용(14~19kg), 점보, 68매",생활용품
"로이첸 뉴 유청분리기 그릭요거트 메이커, 아이보리, 1개",생활용품
"바디럽 퓨어썸 샤워기, 1개, 혼합색상",생활용품
"퍼실 딥클린 파워젤 일반용 액상세제 본품, 1개, 2.7L",생활용품
"비앤비 섬유유연제 자스민 앤 로즈 리필, 1500ml, 3개",생활용품
"코멧 생분해 음식물쓰레기 봉투 50매, 1개, 3.5L",생활용품
"브릭글로 스탠다드 니트릴장갑 100p, 블랙, 대(L), 2개",생활용품
마리슈타이거 양면 스테인레스 스틸 도마,생활용품
"바른생각 젤 스탠다드, 150ml, 1개",생활용품
"코멧 의류용 압축팩 50 x 60 cm, 12개, 1개",생활용품
"앳플리 T8 스마트 더블스마트인 바디 체중계, T8scale, 흰색",생활용품
"크리스탈클라우드 5포트 5.6A 해외 여행용 해외 멀티 플러그 어댑터 CC-305PLUS 로즈골드, 1개",생활용품
"리큐 진한겔 하이브리드 액상세제 일반용 리필, 2.1L, 6개",생활용품
"테르톤 초강력 90도 회전 전기 충전식 모기채 TB-8808, 혼합색상, 1개",생활용품
"스탠리 어드벤쳐 처 텀블러, 폴라 화이트, 473ml",생활용품
"깨끗한나라 데일리 천연펄프 키친타올 200매, 12개",생활용품
"돌체구스토 아이스 아메리카노 캡슐커피, 6.3g, 16개입, 3개",생활용품
"도루코 페이스7 2 프레쉬 면도기 본체 + 면도날 11p 세트, 면도기 + 면도날 11p, 1세트",생활용품
비트 진드기 액체세제 드럼용 본품,생활용품
"바디럽 퓨어썸 여행용 미니 필터 샤워기, 1개",생활용품
"바이오더마 센시비오 H20 민감용 500ml + 250ml, 1개",생활용품
"깨끗한나라 프레쉬 물티슈 페퍼민트 캡형, 70매, 20개",생활용품
"다소다 밤부 도시락통 세트, 브라운 세트, 1세트",생활용품
"퀸센스 올스텐 잔치팬, 1개, 34cm",생활용품
"뷰카 센트 클래식 대용량 디퓨저 선물세트 510ml x 2p, 일랑일랑, 2개",생활용품
"나누담 야채 채소 과일 정리수납 채반 밀폐용기 4000ml, 2개, 단품",생활용품
에이든 홈푸드 1L 다용도 믹서기 MJ-336S,생활용품
"코멧 칵테일 냅킨, 갈색, 1박스, 4000매",생활용품
"피죤 습기제로 본품, 275g, 18개",생활용품
"SK매직 간편핸들 전자레인지 다이얼식 20L, MWO20MC9",생활용품
"깨끗한나라 순수시그니처 27m, 30롤, 1개",생활용품
"스타 디지털 염도계, 혼합색상, 1개",생활용품
"탐사 무인쇄 종이컵 180ml, 2800개입",생활용품
"락앤락 데일리 코튼 도시락 찬합 직사각 3단 + 가방 + 보냉제 세트, 아이보리, 1세트",생활용품
"아크로패스 대용량 패치 24p + 스킨 클렌저 12p 세트, 1세트, 1세트",생활용품
코멧 프리미엄 올스테인리스 식기 건조대 1단,생활용품
"리본제이 무디타 마그넷 스테인리스 슬라이서 멀티 만능 채칼 세트, 1세트, 쿨그레이",생활용품
"닷드 접이식 가스렌지 가림막 아이보리 8P + 보관 파우치, 1개",생활용품
"동우 삼겹살 사각 구이판, 33.2 x 29.8 x 3.5cm, 1개",생활용품
"글래드 매직랩 일반형 30cm x 21.6m, 6개",생활용품
"베베숲 시그니처 블루 유아물티슈 캡형, 70개입, 10개",생활용품
"바이엘 맥스포스 셀렉트 겔 30g+먹이통 30개입, 30g, 1세트",생활용품
"헬로키티 4겹 핑크리본 더블 데코 롤화장지 20m, 30롤, 2팩",생활용품
"비트 진드기 액체세제 일반용 본품, 3L, 4개",생활용품
"바겐슈타이거 스텐304 클라 드레인 앤 커버 싱크대 배수구 거름망 + 커버 세트, 1세트",생활용품
"코멧 이동접이식 빨래건조대 특대형, 혼합색상, 1개",생활용품
"코멧 니트릴장갑 블랙, 대(L), 200개, 1개",생활용품
"2023 하기스 네이처메이드썸머 중형 3단계 밴드형 남여공용(7~10kg), 140매",생활용품
"락앤락 스테커블 직사각 600ml 3P, 3개, 단품",생활용품
"유한락스 멀티액션 레귤러 락스, 6개, 1.8L",생활용품
"크리스탈클라우드 5포트 5.6A 해외 여행용 해외 멀티 플러그 어댑터 CC-305PLUS 로즈골드, 1개",생활용품
"써모스 보온 도시락 TKLF-1200F, 크림, 1개",생활용품
"앳플리 T8 스마트 더블스마트인 바디 체중계, T8scale, 셀레스티얼 블루",생활용품
"2023 하기스 네이처메이드썸머 중형 3단계 밴드형 남여공용(7~10kg), 140매",생활용품
"기본에 세균닦는 행주 티슈 캡형, 80매, 10팩",생활용품
"비타할로 핑크 하드왁스 (모든 부위용), 2개입, 200g",생활용품
"코멧 키친 스테인레스 식기건조대 2단, 블랙",생활용품
"키친플라워 스노우 빙수기, 빙수기 + 빙수용 그릇 2p",생활용품
"SK매직 고급형 전자레인지 20L, MWO-20EC2",생활용품
"락앤락 쌀통 10kg (12L), 1개",생활용품
"락앤락 로즈골드 IH 인덕션 후라이팬, 28cm, 1개",생활용품
"이지드롭 일회용 변기크리너 리필 대용량, 혼합색상, 3개",생활용품
"삼성전자 세라믹 전자레인지 버튼식 23L, MS23K3523AW",생활용품
"테팔 솔레이 스타일리시 토스터기, TT303AKR",생활용품
"쿤달 퓨어 바디워시 베이비파우더향, 1058ml, 2개",생활용품
"코멧 일회용 마스크, 100개입, 1개, 화이트",생활용품
"락앤락 메트로 내열유리 저그 LLG6101, 1.5L",생활용품
"네스프레소 에센자 미니, C30(블랙)",생활용품
"락앤락 메트로 머그 LHC4282, 블루(LHC4282BLU), 600ml",생활용품
"락앤락 뉴자이언트핫탱크 보온병, 사파이어골드, 1.5L",생활용품
"다소다 밤부 도시락통 세트, 브라운 세트, 1세트",생활용품
"코멧 깨끗한 2겹 무형광 핸드타올, 100매, 50개",생활용품
위니웰 고앵스 인테리어 화병 집들이선물 감성 소품 세라믹 북유럽 장식,인테리어
리바트하움 듀얼모터 모션데스크 프로 1200,인테리어
이케아 트롤리 RASKOG 로스코그 로스훌트 웨건 카트 화이트 38x28 cm,인테리어
이케아 LERBERG 4단 철재 선반 와이드 다크그레이 601 864 01,인테리어
폭좁은 거실수납장 베란다 슬림 틈새 낮은수납장 다용도실 높은 미니 2단 3단,인테리어
이케아 LERBERG 4단 철재 선반 와이드 다크그레이 601 864 01,인테리어
동물 바디필로우 인형 대형 모찌 안고자는인형 롱쿠션 어린이날 선물,인테리어
에코트렌드 오브제 전자 렌지 밥솥 수납장 선반 렌지대 600,인테리어
알차스 알루미늄 파티션 가벽 셀프 사무실 원룸 공간분리 드레스룸 만들기 욕실 칸막이 아야빠,인테리어
이케아 트롤리 로스코그 로스훌트 무빙 카트 화이트 국민 기저귀정리함,인테리어
한샘 샘키즈 슈퍼싱글침대 SS 데이베드 + W1400 안전가드,인테리어
슈가 미니멀 현관 맞춤 신발수납장 아파트 사무실 틈새 현관장 신발장 기획전,인테리어
LED 전등 교체 삼성 거실등 방 주방 화장실 원형 국산 조명 등 자석 DIY 셀프 교체,인테리어
패턴 코일 현관매트 베란다 발코니 현관용 매트 업소용 바닥 아파트입구 롤 DIY 매트,인테리어
포시엘라 빨아쓰는 규조토 발매트 3세대 욕실 주방 매트 북유럽 꽃반원,인테리어
[아이르] 1+1 고밀도 밍크 극세사 담요(소형/대형/특대형),인테리어
무아스 플랫우드 포레스트 벽시계 무소음 인테리어 시계,인테리어
아오라 우주빔 우주 조명 별 달 은하수 프로젝터 별똥별 오로라 무드등 수면등 집들이선물,인테리어
인조잔디 매트 옥상 베란다 테라스 시공 인공 롤,인테리어
한샘 포레 컴포트 6인 라운지세트 벤치1 코너벤치1 PP의자2,인테리어
발릴라 3D 프리미엄 매트리스 토퍼 라텍스 에어로 메모리폼 바닥,인테리어
리빙제이 빨아쓰는 규조토 발매트 욕실 주방 화장실 매트 3세대 60x40,인테리어
알렉스 아일랜드식탁 바테이블 홈바 하이테이블 조리대 수납 베이킹작업대,인테리어
책상세트 가구 책상+서랍+의자 사무실가구,인테리어
천일 CIV 타일카페트 조각 매트 베란다 사무실 거실 실내 바닥 인테리어 시공 카펫,인테리어
RM디자인 말리 5단 3단 카트 회전 서랍 이동식 수납 선반 비라인 웨건 보비 트롤리,인테리어
사계절 방수 쇼파패드 소파 토퍼 매트 카우치형 커버 주문제작,인테리어
시스템행거 옷걸이 드레스룸 2단 행거 철제 선반 옷장 조립식 커튼,인테리어
이케아 장 스탠드 조명 플로어 식물등 거실 장스탠드 무드등 램프 스탠딩,인테리어
주방수납장 냉장고 틈새장 홈카페장 냉장고장 냉장고 옆 틈새 수납장,인테리어
장수램프 LED T5 간접조명 싱크대 커튼박스 라인 현관 신발장 욕실 등,인테리어
태양광 정원등 태양열 조명 가로등 전등 LED 전구 잔디,인테리어
본베베 아기 침대가드 낙상방지 유아 안전가드 110,인테리어
토퍼 매트리스 침대 메모리폼 바닥이불 흙침대 접이식 요 누보레 오가닉 SS,인테리어
포시엘라 빨아쓰는 규조토 발매트 3세대 욕실 주방 매트 북유럽 꽃반원,인테리어
누구나 아주쉽게 문짝교체 가능한 제품출시 ABS도어 방문 욕실문 화장실문 셀프시공,인테리어
아동 주니어 남매 성인 여아 2층 테라스 고무나무 LPM 벙커침대 목봉가드,인테리어
(New)라움에스알 6인용 볼륨 양면세라믹 식탁세트 1800/2000,인테리어
온어우드 브라우니 콘솔형 원목 화장대 + 3단 서랍장 세트,인테리어
아망떼 5cm커진 타임리스 60수 아사 피그먼트 고정밴드 침대패드 Q K,인테리어
무무네 웁스 디퓨저 300ml 실내방향제 화장실 인테리어 사무실 선물 대용량 에어리샤워,인테리어
포라이트 루이스 판텔라 플로어 조명 램프 거실 장 스탠드 유광 고급형,인테리어
LG하우시스 진양 두꺼운 모노륨 셀프 장판 시공 바닥 거실 대리석 베란다 LX,인테리어
비트윈 침대 틈새수납장 선반 얇은 틈새장 미니 협탁,인테리어
현대의료기 황토 돌흙침대 205 수납 온열 편백나무,인테리어
3단 다용도 서빙카트 이동식 서빙카 주방카트 업소용 식당 (일반4p),인테리어
마켓비 BINGEURI 회전서랍 트롤리 7단 투명화이트,인테리어
아우스 KOC 메쉬 게이밍 컴퓨터 의자 PC방 편안한 사무용 사무실 책상 학생 의자,인테리어
포라이트 루이스 판텔라 플로어 조명 램프 거실 장 스탠드 유광 고급형,인테리어
스페이스보드 책상 파티션 가림막 메모보드 철제 파티션 스탠드형,인테리어
1+1 킹콩바나나 차르르 쉬폰커튼 거실 나비주름+안방커텐 화이트 암막커튼,인테리어
아라크네 알루미늄 블라인드 30 x 30,인테리어
[폴반] 스토르 전면책장 1200 / 1600,인테리어
만능풀바른벽지 초간단 셀프도배 실크,인테리어
미니 선반 이케아선반 2단 주방 책상 조립 수납 다용도 모듈 선반 S,인테리어
보니애가구 홀란드 아쿠아텍스 패브릭 3인용 전동 리클라이너 소파,인테리어
에코트렌드 오브제 전자 렌지 밥솥 수납장 선반 렌지대 600,인테리어
정국이 사용한 경추베개 거북목 일자목 목디스크 경추 목베개 편백 메밀 베고자니,인테리어
모자이크타일 벽 주방 화장실 욕실 수영장 자기질 포세린 타일,인테리어
엘이디등 LED방등 플리커프리 LED 조명 거실등 전등교체 국산 삼성칩,인테리어
LG지인 한화 KCC 등 호환가능한 클락 샷시손잡이 오토락핸들 셀프교체 인테리어 샷시핸들,인테리어
팬트리선반 다용도수납선반 철제 무타공시스템선반 다용도실 모듈조립 랙 선반장 맞춤제작,인테리어
퍼스퍼 내추럴 바른 자세교정 메쉬 편한 컴퓨터의자 사무용 사무실의자 학생 공부 책상의자,인테리어
이지온 국민튼튼 드레스룸 행거 EO-406 선반 커튼 시스템 행거 모음,인테리어
모달이불 세트 봄이불 알러지케어 간절기 이부자리,인테리어
업소용 테이블 업소 고기집 식당 불판 식탁 서랍 2인용 4인용 수저통 철제 식탁,인테리어
[LEXON]렉슨 MINA L 미나L 미니조명 미니램프 인테리어 무드등 - LH65,인테리어
주방수납장 냉장고 틈새장 홈카페장 냉장고장 냉장고 옆 틈새 수납장,인테리어
스타일러그 여름 대자리 거실 침대 대나무 돗자리,인테리어
지누스 그린티 메모리폼 토퍼 5cm SS,인테리어
소소 구름 4인용 3인용 생활방수 모듈 아쿠아텍스 패브릭 소파,인테리어
휴레카 등받이 쿠션 의자 허리받침 허리받침대 등받이방석,인테리어
탑앤라이프 그랜드 - Z 조립식창고 농막 전원주택 이동식 야외,인테리어
유로 회전책장4단 책꽂이 공간을 차지안하는책장이예요 국내직접제조,인테리어
셀린 러그 카페트 거실 방수 먼지없는 사계절 워셔블 주문제작,인테리어
[국산] 무선센서등 현관 LED 붙이는조명 C고속충전식 센스등 거실계단 주방 욕실 화장실,인테리어
지누스 그린티 메모리폼 토퍼 5cm SS,인테리어
시스템행거 드레스룸 옷걸이 조립식 행거 철제 선반 스탠드 옷장 커튼,인테리어
리바트 뉴프렌즈 1200 책장 5단,인테리어
자바라 홀딩도어 자바라문 접이식문 투명 방염 중문 칸막이,인테리어
테라스 가림막 펜스 옥상 난간 가리개 담장가림막 울타리 휀스 커피브라운1x2m 차양막,인테리어
먼지없는 이불 세트 알러지케어 여름 차렵이불 침구세트,인테리어
보니애가구 홀란드 아쿠아텍스 패브릭 3인용 전동 리클라이너 소파,인테리어
꿈꾸다 원터치 철제 접이식 폴딩 선반 2단 3단 4단 5단 창고 다용도 이동식,인테리어
RM디자인 말리 5단 3단 카트 회전 서랍 이동식 수납 선반 비라인 웨건 보비 트롤리,인테리어
조은자리 대형 바디필로우 6종 듀라론 냉감 죽부인 안고자는 긴 베개 롱쿠션 롱베개 커버,인테리어
LED 투광기 투광등 30W 50w 70w 100w 간판조명 공장등 보안등 고천장등,인테리어
명성아이지 아이지도어 자동중문 3연동 슬라이딩 현관 빌라 친환경 도어 초슬림 미닫이,인테리어
라스본 1488 최쇼 패키지 더블린 더스크 럭셔리 캔들 390g 카시스 리브즈 amp 자스민 트래블,인테리어
누비홈 밴딩 베개커버 순면 누빔 사계절 덮개 베겟잎 밴드형 4060,인테리어
3단 다용도 서빙카트 이동식 서빙카 주방카트 업소용 식당 (일반4p),인테리어
철제수납장 마켓비 수납장 틈새 미니 캐비넷 이동식 수납 이케아 수납장 슬림 책상,인테리어
시디즈 T90 하이엔드 컴퓨터 책상 의자 더블라셀 메쉬 HLDA,인테리어
책상세트 가구 책상+서랍+의자 사무실가구,인테리어
헬로디노 러닝타워 키친헬퍼 접이식 높이조절 낙상방지,인테리어
이케아 LERBERG 4단 철재 선반 와이드 다크그레이 601 864 01,인테리어
데스커 DSAD608 베이직데스크 800x600,인테리어
스마트커브 허리편안C쿠션 허리전만 자동차 요추전만 비행기 의자 등받이,인테리어
2024년형 오스람 스마트방등 LED 방등 거실등 55W 60W 70W 리모컨 와이파이,인테리어
룸핏 무아 유아 책장 교구장 전면책장 거실 아기 낮은 2단 책꽂이 장난감정리장 수납장 선반장,인테리어
더나은 기능성 치질방석 자세교정 꼬리뼈 골반 엉덩이 전립선 허리,인테리어
에이스침대 CA 원매트리스 DS,인테리어
고정밴드 여름 피그먼트이불 인견 알러지케어 순면누빔 침대패드 시어서커 매트리스패드,인테리어
멜론 사무용 가구 컴퓨터 사무실 책상,인테리어
마켓비 AMBO 3인 멀티 소파베드 카우치형,인테리어
데스커 DSAD116D 컴퓨터 데스크 1600x700,인테리어
이코노미쿠스 앉은뱅이 접이식 등받이 좌식의자,인테리어
RM디자인 말리 5단 3단 카트 회전 서랍 이동식 수납 선반 비라인 웨건 보비 트롤리,인테리어
구름 좌식의자 허리 편한 등받이 앉은뱅이 접이식 게이밍,인테리어
에어리빙 쿨매트 100 듀라론 여름 아이스 침대 쿨젤 쿨링 냉매트,인테리어
천일 CIV 타일카페트 조각 매트 베란다 사무실 거실 실내 바닥 인테리어 시공 카펫,인테리어
조인 컴퓨터책상 1인용 2인용 철제 게이밍 800 1000 1200 1400 1600 1800 서재 노트북책상,인테리어
벤치의자방석 긴의자 식탁의자쿠션 북유럽 기능성 패브릭 국내 맞춤제작,인테리어
팬트리선반 다용도수납선반 철제 무타공시스템선반 다용도실 모듈조립 랙 선반장 맞춤제작,인테리어
책상 스탠드조명 독서등 LED 공부스탠드 집게,인테리어
왕자행거 스탠드옷걸이 뉴허니폴 옷걸이,인테리어
위드퍼니처 아르망 접이식 평상 2개 세트 야외 간이 좌탁 침대,인테리어
에코트렌드 오브제 전자 렌지 밥솥 수납장 선반 렌지대 600,인테리어
몰딩 시트지 인테리어필름 띠벽지 걸레받이 문틀 문지방 창틀 샷시 필름지,인테리어
패턴 코일 현관매트 베란다 발코니 현관용 매트 업소용 바닥 아파트입구 롤 DIY 매트,인테리어
폴로까사 로한 4인용 아쿠아텍스 스웨이드 패브릭소파,인테리어
루나랩키즈 어린이 초등학생 바른자세 책상 스마트,인테리어
루나랩 높이조절 스탠드 책상 모션데스크 거치형 800,인테리어
현대의료기 황토 돌흙침대 205 수납 온열 편백나무,인테리어
LED 전등 교체 삼성 거실등 방 주방 화장실 원형 국산 조명 등 자석 DIY 셀프 교체,인테리어
카나모 접이식 안락의자 무중력 침대의자 1인용 암체어 독서 낮잠 릴렉스체어 리클라이너,인테리어
밸런스 쿨링시트 말랑젤리 실리콘 통풍 벌집 쿨방석,인테리어
구름 좌식의자 허리 편한 등받이 앉은뱅이 접이식 게이밍,인테리어
시스템행거 드레스룸 옷걸이 조립식 행거 철제 선반 스탠드 옷장 커튼,인테리어
엘이디등 LED방등 플리커프리 LED 조명 거실등 전등교체 국산 삼성칩,인테리어
책상 연장 선반 확장 테이블 키보드 손목 받침대 52x25cm,인테리어
에넥스 ExW 안나 슬라이딩 여닫이 무몰딩 웨인스코팅 붙박이장 안방맞춤 슬라이드 드레스룸,인테리어
더준 플라스틱 투명의자 아크릴 라운지체어 디자인 카페의자,인테리어
리빙숲 브리즈 각도조절 발받침대 사무실다리받침대,인테리어
책상 연장 선반 확장 테이블 키보드 손목 받침대 52x25cm,인테리어
디아르 시그니쳐 국내산 실리콘 식탁매트 테이블매트 방수,인테리어
3단 에어발쿠션 차량용발받침,인테리어
국산 웨건 서빙 카트 식당 업소용 주방 서빙카 트롤리 써빙카트 2단 3단 무소음 우레탄바퀴,인테리어
헬로디노 러닝타워 키친헬퍼 접이식 높이조절 낙상방지,인테리어
사각 우산 꽂이 우산통 보관통 15구,인테리어
꿈꾸다 원터치 철제 접이식 폴딩 선반 2단 3단 4단 5단 창고 다용도 이동식,인테리어
구르미 9존 접이식 매트리스 MS,인테리어
시디즈 2단 발받침대 패딩형,인테리어
다니엘트리플(블랙)led 3단 위스키장식장 양주진열장 술수납장 양주장 술장 와인 인테리어,인테리어
이케아 장 스탠드 조명 플로어 식물등 거실 장스탠드 무드등 램프 스탠딩,인테리어
틈새수납장 폭좁은 수납장 옷 거실 베란다 다용도 전신 거울 수납장 틈새장 300 400 600,인테리어
드리움 4인용 6인용 12mm통 포세린 세라믹식탁 식탁세트 24년,인테리어
룸핏 무아 유아 책장 교구장 전면책장 거실 아기 낮은 2단 책꽂이 장난감정리장 수납장 선반장,인테리어
데스커 양면 화이트보드 이동형 시리즈,인테리어
LED 투광기 투광등 30W 50w 70w 100w 간판조명 공장등 보안등 고천장등,인테리어
데스커 DSAD608 베이직데스크 800x600,인테리어
이케아 오리털 덕다운 이불 이불커버 침구 세트 슈퍼싱글 퀸 킹,인테리어
에룸포 프리미엄 대용량 디퓨저 250ml 실내방향제 인테리어 선물 호텔 욕실,인테리어
초이’s 존마크 토퍼 ss 슈퍼싱글 1100 X 2000,인테리어
스페이스보드 책상 파티션 가림막 메모보드 철제 파티션 스탠드형,인테리어
DIY 목재재단 합판 방부목 원목 자작 나무 멀바우 미송 레드파인 편백 상판 나무판 각재,인테리어
더준 플라스틱 투명의자 아크릴 라운지체어 디자인 카페의자,인테리어
라자가구 접이식 요추 등받이 좌식의자 모음전,인테리어
이쁜 학원책걸상,인테리어
리시스 멀티 이동형 전신거울 수납 행거 옷장 장롱,인테리어
더나은 기능성 치질방석 자세교정 꼬리뼈 골반 엉덩이 전립선 허리,인테리어
본베베 아기 침대가드 낙상방지 유아 안전가드 110,인테리어
다니엘트리플(블랙)led 3단 위스키장식장 양주진열장 술수납장 양주장 술장 와인 인테리어,인테리어
드브르베 트왈 생활방수 방수 앞치마,인테리어
BMKC 아일랜드 식탁의자 모음전 홈바의자 바텐의자,인테리어
BMKC 아일랜드 식탁의자 모음전 홈바의자 바텐의자,인테리어
상상후 패브릭 포스터 97종 풍경 셀프 거실 인테리어 천 해바라기 액자 150x130,인테리어
콤피라이프 모달원단 150cm 110cm 빨아쓰는 원형 롱 바디필로우 대형 쿠션 솜 포함,인테리어
폭좁은 거실수납장 베란다 슬림 틈새 낮은수납장 다용도실 높은 미니 2단 3단,인테리어
